"StudyID","ArticleCounter","ExperimentCounter","No.","CoderID","ArticleID","StudyNo","StudyType","Experimental_Drug","EffectSizeID","Year","PublicationStatus","PublicationType","Journal","Title","Author","CorrespondenceEmail","DOI","ArticleSource","Country_RegionofOrigin","Continent","SampleNo","SampleSize","Female","FemaleRatio","MeanAge","StudyDesign","IBASampleInfo","IBASampleRandomization","IBAInclusion","IBAExclusion","IBAManipulationInfo","IBADVInfo","IBABaselineTraumaHistory","IBADiaryCodingReliability","IBAAnalysisPlan","IBAPeerReviewed","IBATraumaManipulationCheck","TotalIBAScore","StatExtracted","ExperimentalCondition","Step1_ExperimentalCondition","Intrusion_Predicted_Direction","ComparisonCondition","ComparisonType","Step1_ComparisonCondition","Step2_Individual_technique","Step3_Technique_procedure","Step4_Hypothesized_mechanism","Step4a_Direct_Indirect_involvement","Step4b_Task_Instruction","ExperimentalConditionSampleSize","ComparisonConditionSampleSize","StudySampleSize","TimeOfManipulation","TraumaInductionStimuli","EncodingTask","StimuliNo.","StimuliDuration","DependentVariables","DependentVariablesType","DVTask","ModeOfMeasurement","TimeOfMeasurement","MeasurementDuration","Intrusion_Retro_or_RealTime","Intrusion_Content","ManipulationBeneficial","ResultSummary","PhysioMeasures","ClinicalSymptomMeasures","VoluntaryMemoryMeasure","VoluntaryMemoryDirection","Experimental_Mean","Experimental_SE","Experimental_SD","Comparison_Mean","Comparison_SE","Comparison_SD","GroupDifference","T.test","Z.test","pvalue","EffectSize","EffectSizeType","Notes_fromMo","Notes_fromSZ","DirectionSignSZ","DirectionSignMo","TraumaStimuliType","Physio_binary","Citation_ExpLevel","Citation","Citation_ExpLevel_Detailed","Level2_detailed","ManipulationDiff","TimeDiff","MeasurementDiff","DelayedInterval","sign","F.test","U.test","t.test","CohenD","yi","vi","yi_pos","se","Lower.Limit","Upper.Limit","Z.value","p.value","StudentizedResiduals","outliers","cooks","cooks_inf","DFBETAS","DFBETAS_inf"
45,NA,NA,192,"SZ",38,1,"Behavioural",NA,192,2015,"Published","Journal Article","Neurobiology Of Learning And Memory","The role of stress during memory reactivation on intrusive memories","Cheung, Jessica; Garber, Benjamin; Bryant, Richard A.","r.bryant@unsw.edu.au","10.1016/j.nlm.2015.04.004","Web of Science","Australia","Australia",3,63,34,0.53968254,"19.89","Between-subject",1,1,1,1,1,1,1,NA,1,1,1,10,"page 31, Table 1","Socially evaluated cold pressor test (SECPT) + reactivation","Cold water stress induction + trauma reminder","Increase","Socially evaluated cold pressor test (SECPT) ","Experimental task","Cold water stress induction","Cold water stress induction + trauma reminder vs. Cold water stress induction","Behavioural","Imagery","Direct","Task",21,21,42,"Delayed post","Trauma film","Trauma film","1","10min","IES Intrusion subscale score","Intrusion symptoms","IES (Intrusion subscale)","Self-report questionnaire","5th day post trauma film",NA,"Retrospective",NA,"Negative","Stress/Reactivation condition had significantly more intrusive memories than the Stress condition","Saliva (sAA, cortisol)",NA,"Yes","Null",7,NA,2.9,5.24,NA,2.28,"1.76","t(1,40)=2.19",NA,"< .05","Not provided","Not provided",NA,NA,NA,NA,"Film","Yes","Cheung et al., 2015","Cheung et al., 2015","Cheung et al., 2015","Cold water stress induction + trauma reminder vs. Cold water stress induction",NA,NA,NA,"2 days ",1,NA,NA,2.19,NA,0.66198,0.10045,-0.66198,0.316946243,-1.283191493,-0.04076222,-2.088609255,0.036742911,-0.947383418639286,0,0.0112043452752899,0,-0.108826038892662,0
48,1,1,214,"SZ",41,1,"Behavioural",NA,214,2015,"Published","Journal Article","Journal Of Behavior Therapy And Experimental Psychiatry","How does immediate recall of a stressful event affect psychological response to it?","Gittins, Catherine B.; Paterson, Helen M.; Sharpe, Louise","helen.paterson@sydney.edu.au","10.1016/j.jbtep.2014.07.006","Web of Science","Australia","Australia",4,85,52,0.611764706,"19.56","Between-subject",1,1,1,1,1,1,1,NA,1,1,1,10,"page 23","Self-Administered Interview (SAI)","Writing-based imagery re-experience","Increase","Irrelevant writing task","Experimental task","Control (Irrelevant writing task)","Imagery re-experience","Behavioural","Imagery","Direct","Task",43,42,85,"Immediate post","Trauma film","Trauma film","1","10min","IES-R Intrusion subscale score","Intrusion symptoms","IES-R (Intrusion subscale)","Self-report questionnaire","Same day post trauma film",NA,"Retrospective",NA,"Negative","SAI participants had significantly higher IES-Intrusion scores than controls",NA,"DASS21; STAI","Yes","Positive",8.4,NA,4.95,5,NA,4.22,"3.4",NA,NA,"< .001","0.73","Hedges's g","This article is also a 2*2 design, while there is no interactive effects, should we just report the significant main effect? If so, should we also ask for non-significant main effect？",NA,NA,NA,"Film","No","Gittins et al., 2015","Gittins et al., 2015","Gittins et al., 2015, Immediate post","Imagery re-experience",NA,"Immediate post",NA,NA,1,"F(1,80) = 12.62",NA,NA,NA,0.73181,0.05022,-0.73181,0.224088385,-1.171022833,-0.292596365,-3.265718568,0.001091867,-1.25852635689939,0,0.0652970560589264,0,-0.256780035398782,0
48,NA,NA,216,"SZ",41,1,"Behavioural",NA,216,2015,"Published","Journal Article","Journal Of Behavior Therapy And Experimental Psychiatry","How does immediate recall of a stressful event affect psychological response to it?","Gittins, Catherine B.; Paterson, Helen M.; Sharpe, Louise","helen.paterson@sydney.edu.au","10.1016/j.jbtep.2014.07.006","Web of Science","Australia","Australia",4,85,52,0.611764706,"19.56","Between-subject",1,1,1,1,1,1,1,NA,1,1,1,10,"page 24","Self-Administered Interview (SAI)","Writing-based imagery re-experience","Increase","Irrelevant writing task","Experimental task","Control (Irrelevant writing task)","Imagery re-experience","Behavioural","Imagery","Direct","Task",42,38,80,"Immediate post","Trauma film","Trauma film","1","10min","IES-R Intrusion subscale score","Intrusion symptoms","IES-R (Intrusion subscale)","Self-report questionnaire","8th day post trauma film",NA,"Retrospective",NA,"Null","No group difference on IES-R intrusion subscale between SAI and control group",NA,"DASS21; STAI","Yes","Positive",4.384,0.621,4.024539974,4.439,0.654,4.031526758,"-0.055",NA,NA,NA,"Not provided","Not provided","This article is also a 2*2 design, while there is no interactive effects, should we just report the significant main effect? If so, should we also ask for non-significant main effect？; Stats provided by the author via email",NA,NA,NA,"Film","No","Gittins et al., 2015","Gittins et al., 2015","Gittins et al., 2015, Delayed post","Imagery re-experience",NA,"Delayed post",NA,NA,-1,NA,NA,NA,NA,-0.01352,0.05013,0.01352,0.223889384,-0.425300075,0.452346311,0.06040089,0.95183635,0.452023984680791,0,0.0193986628821572,0,0.132984675074394,0
60,NA,NA,274,"SZ",52,1,"Behavioural",NA,274,2013,"Published","Journal Article","Journal Of Behavior Therapy And Experimental Psychiatry","Unconscious thought reduces intrusion development: a replication and extension","Krans, Julie; Janecko, Dorte; Bos, Maarten W.","j.krans@unsw.edu.au","10.1016/j.jbtep.2012.08.004","Web of Science","Australia","Australia",3,51,47,0.921568627,"19.76","Between-subject",1,1,1,1,1,1,1,NA,1,1,1,10,"page 183, Table 1","Conscious thought condition (trauma recall + memory test expectation)","Imagery re-experience","Increase","Unconscious thought condition (2-back working memory task + memory test expectation)","Experimental task","Unconscious imagery re-experience","Conscious vs. Unconscious imagery re-experience","Behavioural","Imagery","Direct vs. Indirect","Instruction vs. Task",17,17,34,"Immediate post","Trauma film","Trauma film","1","8.42min","IES Intrusion subscale score","Intrusion symptoms","IES (Intrusion subscale)","Self-report questionnaire","Same day post trauma film",NA,"Retrospective",NA,"Negative","UT group showed lower intrusion score than CT group",NA,NA,"Yes","Null",9.29,NA,6.47,5.87,NA,3.63,"3.42",NA,NA,"<0.05","Not provided","Not provided",NA,NA,NA,NA,"Film","No","Krans et al., 2013a","Krans et al., 2013","Krans et al., 2013a","Conscious vs. Unconscious imagery re-experience",NA,NA,NA,NA,1,NA,NA,NA,NA,0.63652,0.12361,-0.63652,0.3515755,-1.3256118,0.052564159,-1.810489698,0.070219881,-0.860492539095887,0,0.0231057328607259,0,-0.151435416405013,0
98,NA,NA,393,"MMV & SZ",84,1,"Behavioural",NA,393,2019,"Published","Journal Article","Cognition And Emotion","Vantage perspective in analogue trauma memories: an experimental study","Mooren, Nora; Krans, Julie; Naring, Gerard; van Minnen, Agnes","n.mooren@uu.nl","10.1080/02699931.2018.1538010","Web of Science","Netherlands","Europe",3,85,85,1,"21.27","Between-subject",1,0,1,1,1,1,1,0,1,1,1,9,"Table 1, page 1266","Field perspective recall","Field perspective recall","Increase","Observer perspective recall","Experimental task","Observer perspective recall","Field vs. Observer perspective recall","Behavioural","Imagery","Direct","Task",24,26,50,"Immediate post","Eyewitness report of real-life road traffic accidents","Trauma analogue induction","4","11min 42s","IES Intrusion subscale score","Intrusion symptoms","IES (Intrusion subscale)","Self-report questionnaire","8th day post trauma film",NA,"Retrospective",NA,"Negative","Field perspective had higher score on IES intrusion subscale than observer perspective",NA,"STAI-S","No",NA,5.65,NA,2.79,2.96,NA,2.9,"2.69",NA,NA,"0.05","Not provided","Not provided",NA,"This paper, the intrusion includes both visual intrusions and visual+verbal intrusion. But the analysis only focused on the total (i.e., (only visual) + (visual+verbal combination)). In this case should we code them seprately?",NA,NA,"Audio","No","Mooren et al., 2019","Mooren et al., 2019","Mooren et al., 2019","Field vs. Observer perspective recall",NA,NA,NA,NA,1,NA,NA,NA,NA,0.92973,0.08877,-0.92973,0.29794668,-1.513707671,-0.345756684,-3.120464964,0.001805658,-1.58665580700233,0,0.0576215628617308,0,-0.257478053348605,0
98,NA,NA,395,"MMV & SZ",84,1,"Behavioural",NA,395,2019,"Published","Journal Article","Cognition And Emotion","Vantage perspective in analogue trauma memories: an experimental study","Mooren, Nora; Krans, Julie; Naring, Gerard; van Minnen, Agnes","n.mooren@uu.nl","10.1080/02699931.2018.1538010","Web of Science","Netherlands","Europe",3,85,85,1,"21.27","Between-subject",1,0,1,1,1,1,1,0,1,1,1,9,"Table 1, page 1266","Field perspective recall","Field perspective recall","Increase","Neutral memory recall","Experimental task","Control (neutral memory recall)","Field perspective recall","Behavioural","Imagery","Direct","Task",24,27,51,"Immediate post","Eyewitness report of real-life road traffic accidents","Trauma analogue induction","4","11min 42s","IES Intrusion subscale score","Intrusion symptoms","IES (Intrusion subscale)","Self-report questionnaire","8th day post trauma film",NA,"Retrospective",NA,"Negative","field perspective condition score higher on IES-intrusion than the control perspective",NA,"STAI-S","No",NA,5.65,NA,2.79,3.89,NA,3.57,"1.76",NA,NA,"0.05","Not provided","Not provided",NA,"This paper, the intrusion includes both visual intrusions and visual+verbal intrusion. But the analysis only focused on the total (i.e., (only visual) + (visual+verbal combination)). In this case should we code them seprately?",NA,NA,"Audio","No","Mooren et al., 2019","Mooren et al., 2019","Mooren et al., 2019","Field perspective recall",NA,NA,NA,NA,1,NA,NA,NA,NA,0.53693,0.08153,-0.53693,0.285534735,-1.096575327,0.022720833,-1.880427079,0.060049896,-0.711114059096641,0,0.00278348829333019,0,-0.0534926530301633,0
127,NA,NA,550,"MMV & SZ",109,2,"Behavioural",NA,550,2020,"Published","Journal Article","Plos One","Arresting visuospatial stimulation is insufficient to disrupt analogue traumatic intrusions","Meyer, Thomas; Brewin, Chris R.; King, John A.; Nijmeijer, Desiree; Woud, Marcella L.; Becker, Eni S.","t.meyer@bsi.ru.nl ","10.1371/journal.pone.0228416","Web of Science","Netherlands","Europe",3,114,90,0.789473684,"21.4","Between-subject",1,1,1,1,1,1,1,0,1,1,1,10,"Table 3, page 12","Imagery + reminder","Trauma reminder + high visual stimulation imagery","Increase","No-Task","No-task","No-Task","Trauma reminder +  visual stimulation imagery","Behavioural","Imagery","Direct + indirect","Task",38,37,75,"Immediate post","Trauma film","Trauma film","Not Reported","14 minutes","IES Intrusion subscale score","Intrusion symptoms","IES (Intrusion subscale)","Self-report questionnaire","8th day post trauma film",NA,"Retrospective",NA,"Null","No group difference on IES intrusion between H-VA+imagery+reminder and no-task control group",NA,NA,"No",NA,10.8,NA,6.1,8.2,NA,5.7,"2.6",NA,NA,"0.21","Not provided","Not provided",NA,NA,NA,NA,"Film","No","Meyer et al., 2020, Exp. 2","Meyer et al., 2020","Meyer et al., 2020, Exp. 2","Trauma reminder +  visual stimulation imagery",NA,NA,NA,NA,1,"F (2,111) = 1.58",NA,NA,NA,0.43568,0.05461,-0.43568,0.233684109,-0.893700742,0.022340966,-1.864396724,0.062266013,-0.538689047822478,0,0.0100760473076569,0,-0.098379139656227,0
129,NA,NA,560,"SZ",111,1,"Behavioural",NA,560,2001,"Published","Journal Article","British Journal Of Medical Psychology","The effect of dissociation at encoding on intrusive memories for a stressful film","Brewin, CR; Saunders, J","Not provided","10.1348/000711201161118","Web of Science","England","Europe",2,39,20,0.512820513,"20","Between-subject",1,1,0,0,1,1,0,0,0,1,0,5,"Not provided","Tapping task","Finger tapping","Increase","No-task","No-task","No-Task","Finger tapping","Behavioural","Imagery","Indirect","Task",20,19,39,"Peri","Trauma film","Trauma film","5","12min","IES Intrusion subscale score","Intrusion symptoms","IES (Intrusion subscale)","Self-report questionnaire","15th day post trauma film",NA,"Retrospective",NA,"Not provided","Not provided",NA,NA,"Yes","Null",NA,NA,NA,NA,NA,NA,"#VALUE!",NA,NA,NA,"Not provided","Not provided","Contact author ; sample size info provided by author via email but stats info is missing data as reported by the author via email",NA,NA,NA,"Film","No","Brewin & Saunders, 2001","Brewin & Saunders, 2001","Brewin & Saunders, 2001","Finger tapping",NA,NA,NA,NA,NA,NA,NA,NA,NA,NA,NA,NA,NA,NA,NA,NA,NA,NA,NA,NA,NA,NA,NA
