"StudyID","ArticleCounter","ExperimentCounter","No.","CoderID","ArticleID","StudyNo","StudyType","Experimental_Drug","EffectSizeID","Year","PublicationStatus","PublicationType","Journal","Title","Author","CorrespondenceEmail","DOI","ArticleSource","Country_RegionofOrigin","Continent","SampleNo","SampleSize","Female","FemaleRatio","MeanAge","StudyDesign","IBASampleInfo","IBASampleRandomization","IBAInclusion","IBAExclusion","IBAManipulationInfo","IBADVInfo","IBABaselineTraumaHistory","IBADiaryCodingReliability","IBAAnalysisPlan","IBAPeerReviewed","IBATraumaManipulationCheck","TotalIBAScore","StatExtracted","ExperimentalCondition","Step1_ExperimentalCondition","Intrusion_Predicted_Direction","ComparisonCondition","ComparisonType","Step1_ComparisonCondition","Step2_Individual_technique","Step3_Technique_procedure","Step4_Hypothesized_mechanism","Step4a_Direct_Indirect_involvement","Step4b_Task_Instruction","ExperimentalConditionSampleSize","ComparisonConditionSampleSize","StudySampleSize","TimeOfManipulation","TraumaInductionStimuli","EncodingTask","StimuliNo.","StimuliDuration","DependentVariables","DependentVariablesType","DVTask","ModeOfMeasurement","TimeOfMeasurement","MeasurementDuration","Intrusion_Retro_or_RealTime","Intrusion_Content","ManipulationBeneficial","ResultSummary","PhysioMeasures","ClinicalSymptomMeasures","VoluntaryMemoryMeasure","VoluntaryMemoryDirection","Experimental_Mean","Experimental_SE","Experimental_SD","Comparison_Mean","Comparison_SE","Comparison_SD","GroupDifference","T.test","Z.test","pvalue","EffectSize","EffectSizeType","Notes_fromMo","Notes_fromSZ","DirectionSignSZ","DirectionSignMo","TraumaStimuliType","Physio_binary","Citation_ExpLevel","Citation","Citation_ExpLevel_Detailed","Level2_detailed","ManipulationDiff","TimeDiff","MeasurementDiff","DelayedInterval","sign","F.test","U.test","t.test","CohenD","yi","vi","yi_pos","se","Lower.Limit","Upper.Limit","Z.value","p.value","StudentizedResiduals","outliers","cooks","cooks_inf","DFBETAS","DFBETAS_inf"
35,NA,NA,151,"MMV & SZ",28,1,"Behavioural",NA,151,2014,"Published","Journal Article","Memory","Emotional impact feedback affects how people remember an analogue trauma event","Takarangi, M. K.; Segovia, D. A.; Dawson, E.; Strange, D.","melanie.takarangi@flinders.edu.au","10.1080/09658211.2013.865238","PubMed","USA","North america",3,72,37,0.513888889,"Not Collected","Between-subject",0.5,0,0,0,1,1,0,0,0,1,1,4.5,"Figure 1, page 1046","Less negative feedback","Less negative feedback of the film","Decrease","No feedback","No-task","No-Task","Negative feedback","Behavioural","Verbal","Direct","Task",24,24,48,"Immediate post","Trauma film","Trauma film","Multiple","5min","IES Intrusion subscale score","Intrusion symptoms","IES (Intrusion subscale)","Self-report questionnaire","8th day post trauma film",NA,"Retrospective",NA,"Null","Both conditions did not significantly on intrusion subscale of IES.",NA,NA,"Yes","Null",8.5,NA,6.09,11.67,NA,6.97,"-3.17",NA,NA,NA,"0.04","partial eta squared","got info from author via email about sample size, raw stats and mean age",NA,NA,NA,"Film","No","Takarangi et al., 2014","Takarangi et al., 2014","Takarangi et al., 2014","Negative feedback",NA,NA,NA,NA,-1,NA,NA,NA,NA,-0.47641,0.0857,0.47641,0.292741401,-0.097367166,1.050179125,1.627395299,0.103653169,0.727643652419227,0,0.0117739249639826,0,0.107835694045386,0
47,NA,NA,200,"MMV & SZ",40,1,"Behavioural",NA,200,2016,"Published","Journal Article","Journal Of Behavior Therapy And Experimental Psychiatry","Reducing involuntary memory by interfering consolidation of stressful auditory information: a pilot study","Tabrizi, Fara; Jansson, Billy","billy.jansson@miun.se ","10.1016/j.jbtep.2015.09.003","Web of Science","Sweden","Europe",4,41,26,0.634146341,"24","Between-subject",1,1,1,1,1,1,0,0,0,1,1,8,"Table 1, page 242","Phonological task (count from 1-10 loudly repeatedly)","Number counting","Decrease","No-Task","No-task","No-Task","Number counting","Behavioural","Verbal","Indirect","Task",10,10,20,"Immediate post","Aversive audio clips","Aversive audio clips","6","10 minutes","IES-R Intrusion subscale score","Intrusion symptoms","IES-R (Intrusion subscale)","Self-report questionnaire","8th day post trauma film",NA,"Retrospective",NA,"Null","Both conditions did not significantly in terms of IES-R intrusion subscale.",NA,NA,"Yes","Null",9.6,NA,6.6,8.1,NA,3.9,"1.5",NA,NA,"0.282","Not provided","Not provided",NA,"Contact author for their distress level. They didn’t report distress level but did record this data",NA,NA,"Audio","No","Tabrizi & Jansson, 2016","Tabrizi & Jansson, 2016","Tabrizi & Jansson, 2016","Number counting (phonological task)","Phonological task",NA,NA,NA,1,"F(3, 37) = 1.32",NA,NA,NA,0.26499,0.20176,-0.26499,0.449172045,-1.145369721,0.615384694,-0.589957715,0.555218999,-0.983177590859822,0,0.00848979631721417,0,-0.0919804184628034,0
47,NA,NA,204,"MMV & SZ",40,1,"Behavioural",NA,204,2016,"Published","Journal Article","Journal Of Behavior Therapy And Experimental Psychiatry","Reducing involuntary memory by interfering consolidation of stressful auditory information: a pilot study","Tabrizi, Fara; Jansson, Billy","billy.jansson@miun.se ","10.1016/j.jbtep.2015.09.003","Web of Science","Sweden","Europe",4,41,26,0.634146341,"24","Between-subject",1,1,1,1,1,1,0,0,0,1,1,8,"Table 1, page 242","Executive task (count backwards for 3 numbers loudly)","Number counting","Decrease","No-Task","No-task","No-Task","Number counting","Behavioural","Verbal","Indirect","Task",11,10,21,"Immediate post","Aversive audio clips","Aversive audio clips","6","10 minutes","IES-R Intrusion subscale score","Intrusion symptoms","IES-R (Intrusion subscale)","Self-report questionnaire","8th day post trauma film",NA,"Retrospective",NA,"Null","Both conditions did not significantly in terms of IES-R intrusion subscale.",NA,NA,"Yes","Null",6.45,NA,5.8,8.1,NA,3.9,"-1.65",NA,NA,"0.282","Not provided","Not provided",NA,"Contact author for their distress level. They didn’t report distress level but did record this data",NA,NA,"Audio","No","Tabrizi & Jansson, 2016","Tabrizi & Jansson, 2016","Tabrizi & Jansson, 2016","Number counting (executive task)","Executive task",NA,NA,NA,-1,"F(3, 37) = 1.32",NA,NA,NA,-0.31734,0.19331,0.31734,0.439666753,-0.544404689,1.179088983,0.721778814,0.470430477,0.206136351529446,0,0.00124769937300364,0,0.0350314040715917,0
97,NA,NA,389,"MMV",83,1,"Behavioural",NA,389,2019,"Published","Journal Article","Behaviour Research And Therapy","Spatio-temporal associations with memory cues are linked to analogue traumatic intrusions","Meyer, Thomas; Ikani, Nessa; Morina, Nexhmedin","t.meyer@uni-muenster.de","10.1016/j.brat.2019.103481","Web of Science","Germany","Europe",2,96,73,0.760416667,"22.4","Within-subject",1,1,1,1,1,1,0,0,1,1,1,9,"Table 3, page 7","Past verbal training","Past verbal training","Decrease","Now verbal training","Experimental task","Now verbal training","Past vs. Now verbal training","Behavioural","Verbal","Direct","Task",96,96,96,"Immediate post","Trauma film","Trauma film","2","20 minutes","IES-R Intrusion subscale score","Intrusion symptoms","IES-R (Intrusion subscale)","Self-report questionnaire","8th day post trauma film",NA,"Retrospective",NA,"Null","Both conditions did not significantly in terms of intrusion subscale ies-r",NA,NA,"No",NA,13.8,NA,12.6,14.9,NA,5.9,"-1.1",NA,NA,NA,"Not provided","Not provided","reported intrusion frequency separately for total intrusions, image intrusion, thought intrusion~ which one to code. Mean and sd currently summed for two film clips as they were reported separately for each of the two conditions.",NA,NA,NA,"Film","No","Meyer et al., 2019","Meyer et al., 2019","Meyer et al., 2019","Past vs. Now verbal training",NA,NA,NA,NA,-1,NA,NA,NA,NA,-0.11137,0.02087,0.11137,0.144449415,-0.171750833,0.394490874,0.770996685,0.440708896,-0.425003414431638,0,0.00774687669219653,0,-0.0864937394341716,0
132,1,1,569,"SZ",114,1,"Behavioural",NA,569,2000,"Published","Journal Article","Journal Of Personality And Social Psychology","Talking facilitates cognitive-emotional processes of adaptation to an acute stressor","Lepore, SJ; Ragan, JD; Jones, S","slepore@brooklyn.cuny.edu","10.1037//0022-3514.78.3.499","Web of Science","USA","North america",4,256,128,0.5,"19.41","Between-subject",1,1,0,0,1,1,0,NA,0,1,1,6,"page 503, Table 2","Talk alone","Talk alone","Decrease","No-talk","No-task","No-Task","Talk alone","Behavioural","Verbal","Direct","Task",64,64,128,"Immediate post","Trauma film","Trauma film","1","14min","IES Intrusion subscale score","Intrusion symptoms","IES (Intrusion subscale)","Self-report questionnaire","3rd day post trauma film",NA,"Retrospective",NA,"Positive","Participants in the no-talk condition had a significantly higher level of intrusive thoughts than did participants in  the talk alone conditions","Blood-pressure and pulse-rate measures ",NA,"No",NA,1.23,NA,0.89,1.8,NA,1.06,"-0.57",NA,NA,"< 0.01","Not provided","Not provided","Contact author for sample size; sample info provided by author via email",NA,NA,NA,"Film","Yes","Lepore et al., 2000","Lepore et al., 2000","Lepore et al., 2000","Talk alone",NA,NA,NA,NA,-1,"F(3, 252) = 3.89",NA,NA,NA,-0.57893,0.03256,0.57893,0.180441752,0.22526577,0.932597437,3.208412675,0.001334698,1.34978465702061,0,0.0164304299450657,0,0.132852260139418,0
132,NA,NA,570,"SZ",114,1,"Behavioural",NA,570,2000,"Published","Journal Article","Journal Of Personality And Social Psychology","Talking facilitates cognitive-emotional processes of adaptation to an acute stressor","Lepore, SJ; Ragan, JD; Jones, S","slepore@brooklyn.cuny.edu","10.1037//0022-3514.78.3.499","Web of Science","USA","North america",4,256,128,0.5,"19.41","Between-subject",1,1,0,0,1,1,0,NA,0,1,1,6,"page 503, Table 2","Validate talk","Validate talk","Decrease","No-talk","No-task","No-Task","Validate talk","Behavioural","Verbal","Direct","Task",64,64,128,"Immediate post","Trauma film","Trauma film","1","14min","IES Intrusion subscale score","Intrusion symptoms","IES (Intrusion subscale)","Self-report questionnaire","3rd day post trauma film",NA,"Retrospective",NA,"Positive","Participants in the no-talk condition had a significantly higher level of intrusive thoughts than did participants in  the validate conditions","Blood-pressure and pulse-rate measures ",NA,"No",NA,1.38,NA,0.95,1.8,NA,1.06,"-0.42",NA,NA,"< 0.01","Not provided","Not provided","Contact author for sample size; sample info provided by author via email",NA,NA,NA,"Film","Yes","Lepore et al., 2000","Lepore et al., 2000","Lepore et al., 2000","Validate talk",NA,NA,NA,NA,-1,"F(3, 252) = 3.89",NA,NA,NA,-0.4148,0.03192,0.4148,0.178667552,0.064608023,0.764984826,2.321610279,0.02025393,0.707125887462086,0,0.000250522452736536,0,0.0160175073514347,0
143,NA,NA,625,"SZ",124,1,"Behavioural",NA,625,2022,"Published","Journal Article","Cognitive Therapy And Research","How expectations shape the formation of intrusive memories: An experimental study using the trauma film paradigm","Herzog, Philipp;Barth, Charlotte;Rief, Winfried;Brakemeier, Eva-Lotta;Kube, Tobias","philipp.herzog@staff.uni-marburg.de","10.1007/s10608-022-10290-4","PROQUEST","Germany","Europe",3,89,42,0.471910112,"24","Between-subject",1,1,1,1,1,1,1,0,1,1,1,10,"Table 2","Positive expectation group (intrusion-inhibiting)","Positive expectation towards intrusion","Decrease","No-expectation control group","No-task","No-Task","Positive expectation towards intrusion","Behavioural","Verbal","Direct","Instruction",24,33,57,"Immediate post","Trauma film","Trauma film","4","12.65min","IES-R Intrusion subscale score","Intrusion symptoms","IES-R (Intrusion subscale)","Self-report questionnaire","8th day post trauma film",NA,"Retrospective",NA,"Null","No group differences were found",NA,NA,"No",NA,13.13,NA,3.37,13.58,NA,3.54,"-0.45",NA,NA,NA,"Not provided","Not provided",NA,NA,NA,NA,"Film","No","Herzog et al., 2022","Herzog et al., 2022","Herzog et al., 2022","Positive expectation towards intrusion",NA,NA,NA,NA,-1,NA,NA,NA,NA,-0.12791,0.07211,0.12791,0.268539028,-0.398428477,0.654244515,0.476310723,0.633853027,-0.268435867984312,0,0.00165041983139474,0,-0.0401645623224816,0
