"StudyID","ArticleCounter","ExperimentCounter","No.","CoderID","ArticleID","StudyNo","StudyType","Experimental_Drug","EffectSizeID","Year","PublicationStatus","PublicationType","Journal","Title","Author","CorrespondenceEmail","DOI","ArticleSource","Country_RegionofOrigin","Continent","SampleNo","SampleSize","Female","FemaleRatio","MeanAge","StudyDesign","IBASampleInfo","IBASampleRandomization","IBAInclusion","IBAExclusion","IBAManipulationInfo","IBADVInfo","IBABaselineTraumaHistory","IBADiaryCodingReliability","IBAAnalysisPlan","IBAPeerReviewed","IBATraumaManipulationCheck","TotalIBAScore","StatExtracted","ExperimentalCondition","Step1_ExperimentalCondition","Intrusion_Predicted_Direction","ComparisonCondition","ComparisonType","Step1_ComparisonCondition","Step2_Individual_technique","Step3_Technique_procedure","Step4_Hypothesized_mechanism","Step4a_Direct_Indirect_involvement","Step4b_Task_Instruction","ExperimentalConditionSampleSize","ComparisonConditionSampleSize","StudySampleSize","TimeOfManipulation","TraumaInductionStimuli","EncodingTask","StimuliNo.","StimuliDuration","DependentVariables","DependentVariablesType","DVTask","ModeOfMeasurement","TimeOfMeasurement","MeasurementDuration","Intrusion_Retro_or_RealTime","Intrusion_Content","ManipulationBeneficial","ResultSummary","PhysioMeasures","ClinicalSymptomMeasures","VoluntaryMemoryMeasure","VoluntaryMemoryDirection","Experimental_Mean","Experimental_SE","Experimental_SD","Comparison_Mean","Comparison_SE","Comparison_SD","GroupDifference","T.test","Z.test","pvalue","EffectSize","EffectSizeType","Notes_fromMo","Notes_fromSZ","DirectionSignSZ","DirectionSignMo","TraumaStimuliType","Physio_binary","Citation_ExpLevel","Citation","Citation_ExpLevel_Detailed","Level2_detailed","ManipulationDiff","TimeDiff","MeasurementDiff","DelayedInterval","sign","F.test","U.test","t.test","CohenD","yi","vi","se","Lower.Limit","Upper.Limit","Z.value","p.value","StudentizedResiduals","outliers","cooks","cooks_inf","DFBETAS","DFBETAS_inf"
53,1,1,234,"MMV & SZ",46,1,"Behavioural",NA,234,2017,"Published","Journal Article","Journal Of Experimental Psychopathology","An analogue investigation into the effect of trauma-related rumination on trauma intrusions and the moderating role of trait rumination and depression","Kubota, Rie; Nixon, Reginald D. V.","reg.nixon@flinders.edu.au ","10.5127/jep.058516","Web of Science","Australia","Australia",2,57,57,1,20.74,"Between-subject",1,1,1,1,1,1,1,0,1,1,1,10,"Table 2, page 422","Rumination","Film-related rumination","Increase","Control group (irrelevant quiz questions)","Experimental task","Control (irrelevant quiz question)","Film-related rumination","Behavioural","Verbal","Direct","Task",28,29,57,"Immediate post","Trauma film","Trauma film","1","8 minutes","Intrusion Frequency","Intrusion frequency","Intrusion questionnaire + Mood ratings","Self-report questionnaire","Same day post trauma film (after reminder)",NA,"Retrospective","Not provided","Null","Both conditions did not significantly in terms of intrusion frequency (AFTER REMINDER)","HR",NA,"No",NA,2.92,NA,2.91,2.375,NA,2.065,0.545,NA,NA,"> .10","Not provided","Not provided",NA,NA,NA,NA,"Film","Yes","Kubota & Nixon, 2017, Exp. 1","Kubota & Nixon, 2017","Kubota & Nixon, 2017, Exp. 1, Post-reminder","Film-related rumination",NA,"Post-reminder",NA,NA,0,NA,NA,NA,NA,-0.201593290707099,0.0567989064807474,0.238325211592788,-0.668710705428965,0.265524124014766,-0.84587480006752,0.397622591857647,-0.665465834919671,0,0.148378399360647,0,-0.155417882743758,0
81,NA,NA,336,"SZ",70,1,"Behavioural",NA,336,2012,"Unpublished","Dissertation",NA,"The role of rumination in ptsd symptom maintenance: an analogue study","Warnock, Kristen","Not provided",NA,"PsycInfo & ProQuest","England","Europe",2,82,64,0.780487805,23.8,"Between-subject",1,1,1,1,1,1,1,0,1,0,1,9,"page 68","Rumination group","Film-related rumination","Increase","Control group (word game)","Experimental task","Control (word task)","Film-related rumination","Behavioural","Verbal","Direct","Task",41,40,81,"Immediate + delayed post","Trauma film","Trauma film","Not Provided","17min30s","Intrusion Frequency","Intrusion frequency","Intrusive memory questionnaire","Self-report questionnaire","Same day post trauma film","2min","Retrospective","Image","Null","No group difference on imediate lab intruision  between rumination and control group","HR, respiration","Rumination (PTQ-S)","No",NA,3.22,NA,5.13,1.83,NA,3.41,1.39,"t(76.3)=-1.16",NA,"0.11","0.32","Cohen's d",NA,NA,NA,NA,"Film","Yes","Warnock, 2012","Warnock, 2012","Warnock, 2012","Film-related rumination",NA,NA,NA,NA,1,NA,NA,1.16,0.32,-0.31531,0.05,0.223606797749979,-0.753579323589959,0.122959323589959,-1.41010918797092,0.158507444691155,-1.34886299507153,0,0.270471184677879,0,-0.535628216449965,0
110,NA,NA,461,"SZ",94,1,"Behavioural",NA,461,2009,"Published","Journal Article","Journal Of Behavior Therapy And Experimental Psychiatry","The effects of rumination on mood and intrusive memories after exposure to traumatic material: an experimental study","Zetsche, Ulrike; Ehring, Thomas; Ehlers, Anke","zetsche@staff.uni-marburg.de","10.1016/j.jbtep.2009.07.001","Web of Science","Netherlands","Europe",3,101,71,0.702970297,24.38,"Between-subject",1,1,1,1,1,1,1,0,1,1,1,10,"page 507, Table 2","Rumination","Film-related rumination","Increase","Memory integration","Experimental task","Control (irrelevant quiz question)","Film-related rumination vs. Autobiographical memory elaboration","Behavioural","Verbal","Direct","Task",32,34.5,66.5,"Immediate post","Trauma film","Trauma film","8","17min30s","Intrusion Frequency","Intrusion frequency","Intrusive Memory Questionnaire (IMQ), triggered","Self-report questionnaire","Same day post trauma film","3min","Retrospective","Image, sound or thought","Null","No group difference on triggered lab intruision  between rumination and memory integration group",NA,NA,"No",NA,6.7,NA,5.46,6.925,NA,6.38,-0.225,NA,NA,NA,"Not provided","Not provided",NA,NA,NA,NA,"Film","No","Zetsche et al., 2009","Zetsche et al., 2009","Zetsche et al., 2009, Triggered","Film-related rumination vs. Autobiographical memory elaboration",NA,NA,"Triggered",NA,0,NA,NA,NA,NA,0.0292653407016844,0.0422593234398739,0.205570726125764,-0.373653282504813,0.432183963908182,0.14236142107014,0.88679453348889,0.282711949425822,0,0.0396098667513853,0,0.100671453540791,0
112,NA,NA,472,"MMV",96,1,"Brain Stimulation",NA,472,2019,"Published","Journal Article","Cognitive Therapy And Research","Does transcranial direct current stimulation affect post-stressor intrusive memories and rumination? an experimental analogue study","Voss, Maria; Ehring, Thomas; Wolkenstein, Larissa","Larissa.Wolkenstein@psy.lmu.de","10.1007/s10608-018-9976-8","Web of Science","Germany","Europe",3,118,118,1,23.32,"Between-subject",1,1,1,1,1,1,0,NA,1,1,1,9,"Table 2, page 541","Cathodal TDCS","Cathodal tdcs","Increase","Sham TDCS","Experimental task","Placebo","Cathodal tdcs","Neuromodulation",NA,NA,NA,38,40,78,"Pre","Trauma film","Trauma film","Not Reported","14 minutes","Intrusion Frequency","Intrusion frequency","Intrusive memories questionnaire","Self-report questionnaire","Same day post trauma film",NA,"Retrospective","Image/thought combined","Null","Both conditions did not significantly in terms of intrusion frequency",NA,"rumination","No",NA,3.45,NA,3.17,4.78,NA,5.75,-1.33,NA,"Not reported","0.84","0.01","eta squared","How to classify the tdcs study as behavioural, neural etc? Used an intrusion questionnaire not previously used in other studies~ is this study eligible for our meta? Also do we code distress as it doesn't ask for distress associated with each intrusion; consult dr. hu on classification of study type, consult dr. hu about whether to code total ies-r/ies or just the intrusion subscale score; osf pre-registration; do we code for vividness or not include in the pre-reg",NA,NA,NA,"Film","No","Voss et al., 2019","Voss et al., 2019","Voss et al., 2019","Cathodal tdcs",NA,NA,NA,NA,-1,NA,NA,NA,NA,0.28166,0.05182,0.227640066772087,-0.16451453087329,0.72783453087329,1.23730415297232,0.215974186655591,1.4757597338485,0,0.296303409705839,0,0.552965675526498,0
114,NA,1,475,"SZ",97,2,"Behavioural",NA,475,2008,"Published","Journal Article","Journal Of Behavior Therapy And Experimental Psychiatry","The influence of data-driven versus conceptually-driven processing on the development of ptsd-like symptoms","Kindt, Merel; van den Hout, Marcel; Arntz, Arnoud; Drost, Jolijn","m.kindt@uva.nl","10.1016/j.jbtep.2007.12.003","Web of Science","Netherlands","Europe",3,73,63,0.863013699,21.7,"Between-subject",1,1,1,1,1,1,1,NA,0,1,1,9,"page 554, Table 3","Data-driven processing","Data-driven processing","Increase","Neutral processing (Irrelevant reading task)","Experimental task","Control (Irrelevant reading task)","Data-driven processing","Behavioural","Imagery","Direct","Task",24,24,48,"Peri","Trauma film","Trauma film","1","29min","Intrusion Frequency","Intrusion frequency","daily 100-mm Visual Analogue Scales (VAS)","Self-report questionnaire","Same day post trauma film","7 days","Retrospective","Image/thought combined","Null","No group differences on daily intrusion frequency",NA,"Negative evaluation of intrusions, suppression of intrusions","No",NA,20.3,NA,13.7,17.1,NA,16.8,3.2,NA,NA,NA,"Not provided","Not provided",NA,NA,NA,NA,"Film","No","Kindt et al., 2008, Exp. 2","Kindt et al., 2008","Kindt et al., 2008, Exp. 2","Data-driven processing",NA,NA,NA,NA,1,"F(1, 47) = 0.57",NA,NA,NA,-0.20534,0.08377,0.289430475244056,-0.772623731478349,0.361943731478349,-0.709462263180308,0.478037661491646,-0.586597670416025,0,0.0268678387551324,0,-0.153117202542286,0
133,NA,NA,576,"SZ",115,1,"Behavioural",NA,576,1997,"Unpublished","Dissertation",NA,"The role of dissociation in the development and maintenance of post-traumatic stress disorder (bl)","Murray, J.","Not provided",NA,"PsycInfo & ProQuest","England","Europe",3,56,29,0.517857143,20.1,"Between-subject",1,1,0,0,1,1,0,0,1,0,1,6,"page 85, Table 5","Dissociation group","Emotional numbing","Increase","Neutral group (attend to the film)","No-task","No-Task","Emotional numbing","Behavioural","Emotion","Direct","Instruction",18,19,37,"Peri","Trauma film","Trauma film","6","10min","Intrusion Frequency","Intrusion frequency","6-month follow-up questionnaire ","Self-report questionnaire","6 months post trauma film",NA,"Retrospective","Not provided","Null","There were no significant differences between the three groups in terms of number of intrusions at 6 months follow-up",NA,NA,"No",NA,0.35,NA,0.61,0.47,NA,0.51,-0.12,NA,NA,"0.231","Not provided","Not provided","df is incosistent with sample sizes",NA,NA,NA,"Film","No","Murray, 1997","Murray, 1997","Murray, 1997","Emotional numbing",NA,NA,NA,NA,-1,"F(2,50) = 1.51",NA,NA,NA,0.20936,0.10878,0.329818131702913,-0.437083538137709,0.855803538137709,0.634774076607114,0.525575772827628,0.755908409357824,0,0.064542493460453,0,0.236161878237044,0
