154,NA,NA,665,"MMV",134,1,"Behavioural",NA,665,2022,"Published","Journal Article","Cognitive Therapy And Research","Using Cognitive Bias Modification-Appraisal Training to Manipulate Appraisals about the Self and the World in Analog Trauma","Würtz, F., Krans, J., Blackwell, S. E., Cwik, J. C., Margraf, J., & Woud, M. L. ","felix.wuertz@rub.de","10.1007/s10608-021-10257-x","Others","Germany","Europe",4,173,122,0.705202312,"24.02","Between-subject",1,1,1,1,1,1,1,0,1,1,1,10,"OSF","Positive CBM-App (Self)","Positive cbm training","Decrease","Negative CBM-App (Self)","Experimental task","Negative CBM training","Positive vs. Negative cbm training","Behavioural","Emotion","Indirect","Task",44,44,88,"Immediate post","Trauma film","Trauma film","11","20 minutes","IES-R Intrusion subscale score","Intrusion symptoms","IES-R (Intrusion subscale)","Self-report questionnaire","8th day post trauma film",NA,"Retrospective",NA,"Null","No group differences were found",NA,NA,"No",NA,3.97,NA,1.07,3.59,NA,0.758,"0.38",NA,"Not provided",NA,"Not provided","Not provided",NA,NA,NA,NA,"Film","No","Würtz et al., 2022","Würtz et al., 2022","Würtz et al., 2022","Positive vs. Negative cbm training (self)","Self",NA,NA,NA,1,NA,NA,NA,NA,0.40624,0.04639,-0.40624,0.215388559,-0.828403724,0.015919426,-1.886089732,0.059282864,-2.21950676538378,1,0.0533508426697393,0,-0.23777869493713,0
154,NA,NA,668,"MMV",134,1,"Behavioural",NA,668,2022,"Published","Journal Article","Cognitive Therapy And Research","Using Cognitive Bias Modification-Appraisal Training to Manipulate Appraisals about the Self and the World in Analog Trauma","Würtz, F., Krans, J., Blackwell, S. E., Cwik, J. C., Margraf, J., & Woud, M. L. ","felix.wuertz@rub.de","10.1007/s10608-021-10257-x","Others","Germany","Europe",4,173,122,0.705202312,"24.02","Between-subject",1,1,1,1,1,1,1,0,1,1,1,10,"OSF","Positive CBM-App World)","Positive cbm training (world)","Decrease","Negative CBM-App (World)","Experimental task","Negative CBM training (World)","Positive vs. Negative cbm training","Behavioural","Emotion","Indirect","Task",42,43,85,"Immediate post","Trauma film","Trauma film","11","20 minutes","IES-R Intrusion subscale score","Intrusion symptoms","IES-R (Intrusion subscale)","Self-report questionnaire","8th day post trauma film",NA,"Retrospective",NA,"Null","No group differences were found",NA,NA,"No",NA,3.55,NA,0.935,3.76,NA,0.963,"-0.21",NA,"Not provided",NA,"Not provided","Not provided",NA,NA,NA,NA,"Film","No","Würtz et al., 2022","Würtz et al., 2022","Würtz et al., 2022","Positive vs. Negative cbm training (world)","World",NA,NA,NA,-1,NA,NA,NA,NA,-0.21922,0.04735,0.21922,0.217595998,-0.207272023,0.64570429,1.00744561,0.313720683,0.033238277193221,0,0.034856169860378,0,0.176583763388418,0
155,NA,NA,671,"MMV",135,1,"Behavioural",NA,671,2021,"Published","Journal Article","Scientific Reports","Investigating the effect of a nap following experimental trauma on analogue PTSD symptoms","Wilhelm, I., Azza, Y., Brennwald, K., Ehrt-Schäfer, Y., Seifritz, E., & Kleim, B.","ines.wilhelm-groch@uksh.de","10.1038/s41598-021-83838-1","PUBMED","Switzerland","Europe",2,56,56,1,"23.5","Between-subject",1,1,1,1,1,1,1,0,1,1,1,10,"Page 6","Sleep","Sleep","Decrease","Wake","Experimental task","No Sleep","Sleep","Behavioural","Other","Indirect","Task",33,23,56,"Immediate post","Trauma film","Trauma film","1","12 minutes","IES-R Intrusion subscale score","Intrusion symptoms","IES-R (Intrusion subscale)","Self-report questionnaire","8th day post trauma film",NA,"Retrospective",NA,"Null","No group differences were found","PSG",NA,"No",NA,NA,NA,NA,NA,NA,NA,"#VALUE!",NA,"Not provided","0.46","Not provided","Not provided","Need to contact author for IES-R intrusion subscale",NA,NA,NA,"Film","Yes","Wilhelm et al., 2021","Wilhelm et al., 2021","Wilhelm et al., 2021","Sleep",NA,NA,NA,NA,NA,"F(1,53) = 0.56",NA,NA,NA,NA,NA,NA,NA,NA,NA,NA,NA,NA,NA,NA,NA,NA,NA
162,NA,NA,689,"SZ",142,1,"Behavioural",NA,689,2024,"Published","Journal Article","Journal Of Behavior Therapy And Experimental Psychiatry","The effectiveness of two novel approaches to prevent intrusions: A pilot study comparing Tetris_dualtask and imagery rescripting to control","Asselbergs, Joost; Riper, Heleen; Engelhard, Iris M.; Mannes, Fancy; Sijbrandij, Marit","e.m.sijbrandij@vu.nl","10.1016/j.jbtep.2023.101920","Pubmed","Netherlands","Europe",3,60,34,0.566666667,"23.6","Between-subject",1,1,1,1,1,1,1,0,1,1,1,10,"Page 4, Table 1","Trauma reminder + Tetris_dualtask","Trauma reminder + tetris","Decrease","Trauma reminder","Experimental task","Trauma reminder","Trauma reminder + tetris vs. Trauma reminder","Behavioural","Imagery","Direct + indirect","Task",20,20,40,"Immediate post","Trauma film","Trauma film","4","10min","IES Intrusion subscale score","Intrusion symptoms","IES-R (Intrusion subscale)","Self-report questionnaire","8th day post trauma film",NA,"Retrospective",NA,"Null","No group differences were found between Tetris and no-task group",NA,NA,"Yes","Null",2.9,NA,2.59,4,NA,3.83,"-1.1",NA,"Not provided",NA,"Not provided",NA,NA,NA,NA,NA,"Film","No","Asselbergs et al., 2023","Asselbergs et al., 2023","Asselbergs et al., 2023","Tetris",NA,NA,NA,NA,-1,NA,NA,NA,NA,-0.32977,0.10136,0.32977,0.318369819,-0.294236243,0.953773447,1.035803591,0.300293782,0.29415815956238,0,0.000784102526056433,0,0.027860013243407,0
162,NA,NA,690,"SZ",142,1,"Behavioural",NA,690,2024,"Published","Journal Article","Journal Of Behavior Therapy And Experimental Psychiatry","The effectiveness of two novel approaches to prevent intrusions: A pilot study comparing Tetris_dualtask and imagery rescripting to control","Asselbergs, Joost; Riper, Heleen; Engelhard, Iris M.; Mannes, Fancy; Sijbrandij, Marit","e.m.sijbrandij@vu.nl","10.1016/j.jbtep.2023.101920","Pubmed","Netherlands","Europe",3,60,34,0.566666667,"23.6","Between-subject",1,1,1,1,1,1,1,0,1,1,1,10,"Page 4, Table 1","Trauma reminder + Imagery rescripting","Trauma reminder + imagery rescripting","Decrease","Trauma reminder","Experimental task","Trauma reminder","Trauma reminder + imagery rescripting vs. Trauma reminder","Behavioural","Imagery","Direct","Task",20,20,40,"Immediate post","Trauma film","Trauma film","4","10min","IES Intrusion subscale score","Intrusion symptoms","IES-R (Intrusion subscale)","Self-report questionnaire","8th day post trauma film",NA,"Retrospective",NA,"Null","No group differences were found between imagery rescripting and no-task group",NA,NA,"Yes","Null",3.2,NA,2.19,4,NA,3.83,"-0.8",NA,"Not provided",NA,"Not provided",NA,NA,NA,NA,NA,"Film","No","Asselbergs et al., 2023","Asselbergs et al., 2023","Asselbergs et al., 2023","Imagery rescripting",NA,NA,NA,NA,-1,NA,NA,NA,NA,-0.25133,0.10079,0.25133,0.317473803,-0.370913764,0.873583542,0.791671272,0.428552378,0.0859927228124856,0,0.000000411184411892872,0,-0.000637596671338445,0
165,NA,NA,701,"MMV",145,1,"Behavioural",NA,701,2023,"Published","Journal Article","Journal Of Behavior Therapy And Experimental Psychiatry","Cognitive flexibility moderates the efficacy of a visuospatial intervention following exposure to analog trauma","Hemi, Alla; Sopp, M. Roxanne; Perel, Ariel; Holmes, Emily A.; Levy-Gigi, Einat","Einat.levy-gigi@biu.ac.il","10.1016/j.jbtep.2023.101858","Pubmed","Israel","Asia",2,60,40,0.666666667,"29.07","Between-subject",1,1,1,1,1,1,0,0,1,1,1,9,"Table 3, page 5","Reactivation + Tetris","Trauma reminder + tetris","Decrease","Reactivation + No-Task","Experimental task","Trauma reminder","Trauma reminder + tetris vs. Trauma reminder","Behavioural","Imagery","Direct + indirect","Task",30,30,60,"Immediate post","Trauma film","Trauma film","11","12 minutes","IES-R Intrusion subscale score","Intrusion symptoms","IES-R (Intrusion subscale)","Self-report questionnaire","8th day post trauma film",NA,"Retrospective",NA,"Null","No group difference",NA,NA,"Yes","Mixed",6.57,NA,6.4,9.97,NA,10.34,"-3.4","t(58)=1.53","Not provided","0.131","0.396","Cohen's d",NA,NA,NA,NA,"Film","Yes","Hemi et al., 2023","Hemi et al., 2023","Hemi et al., 2023","Trauma reminder + tetris vs. Trauma reminder",NA,NA,NA,NA,-1,NA,NA,-1.53,-0.396,-0.39027,0.06794,0.39027,0.260645195,-0.120595288,0.901133877,1.497320119,0.134309982,0.521431895534387,0,0.00722654195658078,0,0.084148589997065,0
