"StudyID","ArticleCounter","ExperimentCounter","No.","CoderID","ArticleID","StudyNo","StudyType","Experimental_Drug","EffectSizeID","Year","PublicationStatus","PublicationType","Journal","Title","Author","CorrespondenceEmail","DOI","ArticleSource","Country_RegionofOrigin","Continent","SampleNo","SampleSize","Female","FemaleRatio","MeanAge","StudyDesign","IBASampleInfo","IBASampleRandomization","IBAInclusion","IBAExclusion","IBAManipulationInfo","IBADVInfo","IBABaselineTraumaHistory","IBADiaryCodingReliability","IBAAnalysisPlan","IBAPeerReviewed","IBATraumaManipulationCheck","TotalIBAScore","StatExtracted","ExperimentalCondition","Step1_ExperimentalCondition","Intrusion_Predicted_Direction","ComparisonCondition","ComparisonType","Step1_ComparisonCondition","Step2_Individual_technique","Step3_Technique_procedure","Step4_Hypothesized_mechanism","Step4a_Direct_Indirect_involvement","Step4b_Task_Instruction","ExperimentalConditionSampleSize","ComparisonConditionSampleSize","StudySampleSize","TimeOfManipulation","TraumaInductionStimuli","EncodingTask","StimuliNo.","StimuliDuration","DependentVariables","DependentVariablesType","DVTask","ModeOfMeasurement","TimeOfMeasurement","MeasurementDuration","Intrusion_Retro_or_RealTime","Intrusion_Content","ManipulationBeneficial","ResultSummary","PhysioMeasures","ClinicalSymptomMeasures","VoluntaryMemoryMeasure","VoluntaryMemoryDirection","Experimental_Mean","Experimental_SE","Experimental_SD","Comparison_Mean","Comparison_SE","Comparison_SD","GroupDifference","T.test","Z.test","pvalue","EffectSize","EffectSizeType","Notes_fromMo","Notes_fromSZ","DirectionSignSZ","DirectionSignMo","TraumaStimuliType","Physio_binary","Citation_ExpLevel","Citation","Citation_ExpLevel_Detailed","Level2_detailed","ManipulationDiff","TimeDiff","MeasurementDiff","DelayedInterval","sign","F.test","U.test","t.test","CohenD","yi","vi","yi_pos","se","Lower.Limit","Upper.Limit","Z.value","p.value","StudentizedResiduals","outliers","cooks","cooks_inf","DFBETAS","DFBETAS_inf"
14,NA,NA,61,"SZ",10,1,"Behavioural",NA,61,2016,"Published","Journal Article","Behavior Therapy","""Why"" or ""How"": The Effect of Concrete Versus Abstract Processing on Intrusive Memories Following Analogue Trauma","White, Rachel; Wild, Jennifer","rachel.white@slam.nhs.uk","10.1016/j.beth.2016.02.004","Web of Science","England","Europe",2,50,28,0.56,"25.98","Between-subject",1,1,1,1,1,1,1,0,1,1,1,10,"page 411, Figure 3","Concrete processing","Concrete processing","Decrease","Abstract processing","Experimental task","Film-related rumination","Concrete processing vs. Film-related rumination","Behavioural","Imagery vs. Verbal","Direct","Instruction",25,25,50,"Peri","Trauma film","Trauma film","8","Not Provided","IES-R Intrusion subscale score","Intrusion symptoms","IES-R (Intrusion subscale)","Self-report questionnaire","8th day post trauma film",NA,"Retrospective",NA,"Not provided","Not provided",NA,NA,"No",NA,NA,NA,NA,NA,NA,NA,"#VALUE!",NA,NA,NA,"Not provided","Not provided","Contact author for intrusion subscale score",NA,NA,NA,"Film","No","White & Wild, 2016","White & Wild, 2016","White & Wild, 2016","Concrete processing vs. Film-related rumination",NA,NA,NA,NA,NA,NA,NA,NA,NA,NA,NA,NA,NA,NA,NA,NA,NA,NA,NA,NA,NA,NA,NA
18,NA,NA,71,"MMV & SZ",13,1,"Behavioural",NA,71,2002,"Published","Journal Article","Journal Of Behavior Therapy And Experimental Psychiatry","Cognitive processing, memory, and the development of ptsd symptoms: two experimental analogue studies","Halligan, SL; Clark, DM; Ehlers, A","S.L.Halligan@reading.ac.uk","10.1016/S0005-7916(02)00014-9","Web of Science","England","Europe",2,61,28,0.459016393,"20.25","Between-subject",0.5,1,0,0,1,1,0,NA,0,1,1,5.5,"Page 79","Conceptual processing","Conceptual processing","Decrease","Data-driven processing","Experimental task","Data-driven processing","Conceptual vs. Data-driven processing","Behavioural","Verbal vs. Imagery","Direct","Instruction",30,31,61,"Peri","Trauma film","Trauma film","Not Reported","12min","Intrusion subscale score","Intrusion symptoms","Symptom Questionnaire","Self-report questionnaire","8th day post trauma film",NA,"Retrospective",NA,"Null","Both conditions did not significantly in terms of intrusions subscale.",NA,NA,"Yes","Positive",NA,NA,NA,NA,NA,NA,"#VALUE!",NA,NA,NA,"Not Reported","Not Reported","Need stats from author",NA,NA,NA,"Film","No","Halligan et al., 2002","Halligan et al., 2002","Halligan et al., 2002","Conceptual vs. Data-driven processing",NA,NA,NA,NA,NA,NA,NA,NA,NA,NA,NA,NA,NA,NA,NA,NA,NA,NA,NA,NA,NA,NA,NA
50,1,1,226,"MMV",43,1,"Behavioural",NA,226,2016,"Published","Journal Article","Plos One","Activating attachments reduces memories of traumatic images","Bryant, Richard A.; Foord, Rachael","r.bryant@.unsw.edu.au","10.1371/journal.pone.0162550","Web of Science","Australia","Australia",2,63,23,0.343283582,"19.78","Between-subject",1,1,1,1,1,1,0,NA,1,1,1,9,"Supplementary data","View attachment-related images","Attachment priming","Decrease","View non-attachment images","Experimental task","Control (positive mood induction)","Attachment priming","Behavioural","Emotion","Indirect","Task",30,30,60,"Peri","Negative + Neutral Pictures","Picture Viewing","40","200 seconds","IES-R Intrusion subscale score","Intrusion symptoms","IES-R (Intrusion subscale)","Self-report questionnaire","2nd day post trauma film",NA,"Retrospective",NA,"Null","Both conditions did not significantly in terms of IES-R intrusion subscale.",NA,NA,"Yes","Null",0.8,0.28,1.52,1.47,0.38,2.1,"-0.67",NA,NA,NA,"Not provided","Not provided","Is the manipulation peri or pre?","Stats calculated from raw datset",NA,NA,"Picture","No","Bryant & Foord, 2016","Bryant & Foord, 2016","Bryant & Foord, 2016","Attachment priming",NA,NA,NA,NA,-1,NA,NA,NA,NA,-0.36075,0.06775,0.36075,0.260290596,-0.149415725,0.870923412,1.385965721,0.165757371,0.43193617531632,0,0.0050321791083457,0,0.0701480543533402,0
93,NA,NA,372,"SZ",79,1,"Behavioural",NA,372,2010,"Published","Journal Article","Journal Of Anxiety Disorders","I see what you're saying: intrusive images from listening to a traumatic verbal report","Krans, Julie; Naring, Gerard; Holmes, Emily A.; Becker, Eni S.","J.Krans@psych.ru.nl","10.1016/j.janxdis.2009.09.009","Web of Science","Netherlands","Europe",3,86,60,0.697674419,"22.01","Between-subject",1,1,1,1,1,1,1,0,1,1,1,10,"page 137, Table 2","Visualspatial interference task during encoding (shaping plasticine)","Clay modeling","Decrease","No-task","No-task","No-Task","Clay modeling","Behavioural","Imagery","Indirect","Task",27,28,55,"Peri","Verbal report of trauma film","Lisen to verbal report of trauma film","4","11min42s","IES Intrusion subscale score","Intrusion symptoms","IES (Intrusion subscale)","Self-report questionnaire","8th day post trauma film",NA,"Retrospective",NA,"Not provided","Not provided",NA,NA,"Yes","Null",3.7,NA,3.58,5.11,NA,2.53,"-1.41",NA,NA,NA,"Not provided","Not provided","Contact Emily for sample size; sample size and trauma stimuli info provide by author via email",NA,NA,NA,"Audio","No","Krans et al., 2010a","Krans et al., 2010","Krans et al., 2010a","Clay modeling",NA,NA,NA,NA,-1,NA,NA,NA,NA,-0.44982,0.07459,0.44982,0.273113045,-0.085484487,0.985118651,1.64699962,0.099558124,0.682923253516043,0,0.0114481187574145,0,0.106202214830888,0
124,NA,NA,525,"SZ",107,1,"Behavioural",NA,525,2004,"Unpublished","Dissertation",NA,"The role of peri-traumatic visuo-spatial and verbal interference on the development of intrusions","Frasquilho, Francisco M.","Not provided",NA,"PsycInfo & ProQuest","England","Europe",3,40,17,0.425,"29","Between-subject",1,1,1,1,1,1,1,0,1,0,1,9,"page 117, Table 6","Visuo-Spatial Task ","Finger tapping","Decrease","No-task","No-task","No-Task","Finger tapping","Behavioural","Imagery","Indirect","Task",11,14,25,"Peri","Trauma film","Trauma film","5","13min3s","IES Intrusion subscale score","Intrusion symptoms","IES (Intrusion subscale)","Self-report questionnaire","7th day post trauma film",NA,"Retrospective",NA,"Null","No group difference on IES intrusion  between visual-spatial interference group and control group",NA,NA,"Yes","Null",5.9,NA,4.08,5.85,NA,5.3,"0.05",NA,NA,">0.05","Not provided","Not provided",NA,NA,NA,NA,"Film","No","Frasquilho, 2004","Frasquilho, 2004","Frasquilho, 2004","Finger tapping",NA,NA,NA,NA,1,"F(2, 37)= 1.23",NA,NA,NA,0.01006,0.16234,-0.01006,0.402913992,-0.7997678,0.779655048,-0.024959113,0.980087576,-0.507641270898065,0,0.00340070913563029,0,-0.0580318698643554,0
