"StudyID","ArticleCounter","ExperimentCounter","No.","CoderID","ArticleID","StudyNo","StudyType","Experimental_Drug","EffectSizeID","Year","PublicationStatus","PublicationType","Journal","Title","Author","CorrespondenceEmail","DOI","ArticleSource","Country_RegionofOrigin","Continent","SampleNo","SampleSize","Female","FemaleRatio","MeanAge","StudyDesign","IBASampleInfo","IBASampleRandomization","IBAInclusion","IBAExclusion","IBAManipulationInfo","IBADVInfo","IBABaselineTraumaHistory","IBADiaryCodingReliability","IBAAnalysisPlan","IBAPeerReviewed","IBATraumaManipulationCheck","TotalIBAScore","StatExtracted","ExperimentalCondition","Step1_ExperimentalCondition","Intrusion_Predicted_Direction","ComparisonCondition","ComparisonType","Step1_ComparisonCondition","Step2_Individual_technique","Step3_Technique_procedure","Step4_Hypothesized_mechanism","Step4a_Direct_Indirect_involvement","Step4b_Task_Instruction","ExperimentalConditionSampleSize","ComparisonConditionSampleSize","StudySampleSize","TimeOfManipulation","TraumaInductionStimuli","EncodingTask","StimuliNo.","StimuliDuration","DependentVariables","DependentVariablesType","DVTask","ModeOfMeasurement","TimeOfMeasurement","MeasurementDuration","Intrusion_Retro_or_RealTime","Intrusion_Content","ManipulationBeneficial","ResultSummary","PhysioMeasures","ClinicalSymptomMeasures","VoluntaryMemoryMeasure","VoluntaryMemoryDirection","Experimental_Mean","Experimental_SE","Experimental_SD","Comparison_Mean","Comparison_SE","Comparison_SD","GroupDifference","T.test","Z.test","pvalue","EffectSize","EffectSizeType","Notes_fromMo","Notes_fromSZ","DirectionSignSZ","DirectionSignMo","TraumaStimuliType","Physio_binary","Citation_ExpLevel","Citation","Citation_ExpLevel_Detailed","Level2_detailed","ManipulationDiff","TimeDiff","MeasurementDiff","DelayedInterval","sign","F.test","U.test","t.test","CohenD","yi","vi","yi_pos","se","Lower.Limit","Upper.Limit","Z.value","p.value","StudentizedResiduals","outliers","cooks","cooks_inf","DFBETAS","DFBETAS_inf"
9,NA,NA,35,"MMV & SZ",6,1,"Behavioural",NA,35,2012,"Published","Journal Article","Emotion","Ameliorating intrusive memories of distressing experiences using computerized reappraisal training","Woud, M. L., Holmes, E., A., Postma, P., Dalgleish, T., & Mackintosh, B.","emily.holmes@psych.ox.ac.uk","10.1037/a0024992","Others","England","Europe",2,74,37,0.5,"22.47","Between-subject",1,1,1,1,1,1,1,0,0,1,1,9,"Table 1, page 14","Positive Cognitive Bias Modification-Appraisal (CBM-app)","Positive cbm training","Decrease","Negative Cognitive Bias Modification-Appraisal (CBM-app)","Experimental task","Negative CBM training","Positive vs. Negative cbm training","Behavioural","Emotion","Indirect","Task",37,37,74,"Immediate post","Trauma film","Trauma film","Not Reported","20min","IES-R Intrusion subscale score","Intrusion symptoms","IES-R (Intrusion subscale)","Self-report questionnaire","8th day post trauma film",NA,"Retrospective",NA,"Positive","Positive CBM-App condition had lower IES-R scores than Negative CBM-App condition",NA,"Posttraumatic Cognitions Inventory (PTCI)","No",NA,NA,NA,NA,NA,NA,NA,"#VALUE!",NA,NA,NA,"Not Reported","Not Reported","Provided combined score for IES-R so how to categorize it as a DV?",NA,NA,NA,"Film","No","Woud et al., 2012","Woud et al., 2012","Woud et al., 2012","Positive vs. Negative cbm training",NA,NA,NA,NA,NA,NA,NA,NA,NA,NA,NA,NA,NA,NA,NA,NA,NA,NA,NA,NA,NA,NA,NA
19,NA,NA,74,"MMV & SZ",14,1,"Behavioural",NA,74,2009,"Published","Journal Article","Plos One","Can playing the computer game ""tetris'' reduce the build-up of flashbacks for trauma? a proposal from cognitive science","Holmes, Emily A.; James, Ella L.; Coode-Bate, Thomas; Deeprose, Catherine","emily.holmes@psych.ox.ac.uk","10.1371/journal.pone.0004153","Web of Science","England","Europe",2,40,18,0.45,"23.4","Between-subject",1,1,0,0,1,1,0,0,0,1,1,6,"Figure 3, page 4","Reminder + Tetris","Trauma reminder + tetris","Decrease","Reminder + No-task","Experimental task","Trauma reminder","Trauma reminder + tetris vs. Trauma reminder","Behavioural","Imagery","Direct + indirect","Task",20,20,40,"Immediate post","Trauma film","Trauma film","11","12min","IES Intrusion subscale score","Intrusion symptoms","IES (Intrusion subscale)","Self-report questionnaire","8th day post trauma film",NA,"Retrospective",NA,"Positive","Tetris condition had lower IES-R scores than control condition",NA,NA,"Yes","Null",7.25,NA,5.01,11.65,NA,6.8,"-4.4","t(38)=2.47",NA,"< .02","Not Reported","Not Reported","image-based intrusions; Got stat info from the author via email",NA,NA,NA,"Film","No","Holmes et al., 2009","Holmes et al., 2009","Holmes et al., 2009","Trauma reminder + tetris vs. Trauma reminder",NA,NA,NA,NA,-1,NA,NA,-2.47,NA,-0.72206,0.10652,0.72206,0.326369743,0.082379509,1.3617489,2.2124116,0.026938238,1.32495333560028,0,0.0317596397621535,0,0.179164070087602,0
35,NA,NA,151,"MMV & SZ",28,1,"Behavioural",NA,151,2014,"Published","Journal Article","Memory","Emotional impact feedback affects how people remember an analogue trauma event","Takarangi, M. K.; Segovia, D. A.; Dawson, E.; Strange, D.","melanie.takarangi@flinders.edu.au","10.1080/09658211.2013.865238","PubMed","USA","North america",3,72,37,0.513888889,"Not Collected","Between-subject",0.5,0,0,0,1,1,0,0,0,1,1,4.5,"Figure 1, page 1046","Less negative feedback","Less negative feedback of the film","Decrease","No feedback","No-task","No-Task","Negative feedback","Behavioural","Verbal","Direct","Task",24,24,48,"Immediate post","Trauma film","Trauma film","Multiple","5min","IES Intrusion subscale score","Intrusion symptoms","IES (Intrusion subscale)","Self-report questionnaire","8th day post trauma film",NA,"Retrospective",NA,"Null","Both conditions did not significantly on intrusion subscale of IES.",NA,NA,"Yes","Null",8.5,NA,6.09,11.67,NA,6.97,"-3.17",NA,NA,NA,"0.04","partial eta squared","got info from author via email about sample size, raw stats and mean age",NA,NA,NA,"Film","No","Takarangi et al., 2014","Takarangi et al., 2014","Takarangi et al., 2014","Negative feedback",NA,NA,NA,NA,-1,NA,NA,NA,NA,-0.47641,0.0857,0.47641,0.292741401,-0.097367166,1.050179125,1.627395299,0.103653169,0.727643652419227,0,0.0117739249639826,0,0.107835694045386,0
37,NA,NA,162,"MMV & SZ",30,1,"Behavioural",NA,162,2015,"Published","Journal Article","Plos One","Updating versus exposure to prevent consolidation of conditioned fear","Pile, Victoria; Barnhofer, Thorsten; Wild, Jennifer","jennifer.wild@psy.ox.ac.uk","10.1371/journal.pone.0122971","Web of Science","England","Europe",3,115,87,0.756521739,"26.72","Between-subject",1,1,1,1,1,1,1,0,1,1,1,10,"page 14, Table 7","Exposure + verbal update","Trauma re-exposure + verbal update","Decrease","Control group","Experimental task","Control (view non-traumatic films)","Trauma re-exposure + verbal update","Behavioural","Imagery + verbal","Direct","Task",37,36,73,"Immediate post","Trauma film","Trauma film + CS+","6","10.85min","IES-R Intrusion subscale score","Intrusion symptoms","IES-R (Intrusion subscale)","Self-report questionnaire","A week post trauma film",NA,"Retrospective",NA,"Not Reported","Not Reported","SCR",NA,"No",NA,NA,NA,NA,NA,NA,NA,"#VALUE!",NA,NA,NA,"Not Reported","Not Reported","Contact author for intrusion subscale score",NA,NA,NA,"Film","Yes","Pile et al., 2015","Pile et al., 2015","Pile et al., 2015","Trauma re-exposure + verbal update",NA,NA,NA,NA,NA,NA,NA,NA,NA,NA,NA,NA,NA,NA,NA,NA,NA,NA,NA,NA,NA,NA,NA
47,NA,NA,200,"MMV & SZ",40,1,"Behavioural",NA,200,2016,"Published","Journal Article","Journal Of Behavior Therapy And Experimental Psychiatry","Reducing involuntary memory by interfering consolidation of stressful auditory information: a pilot study","Tabrizi, Fara; Jansson, Billy","billy.jansson@miun.se ","10.1016/j.jbtep.2015.09.003","Web of Science","Sweden","Europe",4,41,26,0.634146341,"24","Between-subject",1,1,1,1,1,1,0,0,0,1,1,8,"Table 1, page 242","Phonological task (count from 1-10 loudly repeatedly)","Number counting","Decrease","No-Task","No-task","No-Task","Number counting","Behavioural","Verbal","Indirect","Task",10,10,20,"Immediate post","Aversive audio clips","Aversive audio clips","6","10 minutes","IES-R Intrusion subscale score","Intrusion symptoms","IES-R (Intrusion subscale)","Self-report questionnaire","8th day post trauma film",NA,"Retrospective",NA,"Null","Both conditions did not significantly in terms of IES-R intrusion subscale.",NA,NA,"Yes","Null",9.6,NA,6.6,8.1,NA,3.9,"1.5",NA,NA,"0.282","Not provided","Not provided",NA,"Contact author for their distress level. They didn’t report distress level but did record this data",NA,NA,"Audio","No","Tabrizi & Jansson, 2016","Tabrizi & Jansson, 2016","Tabrizi & Jansson, 2016","Number counting (phonological task)","Phonological task",NA,NA,NA,1,"F(3, 37) = 1.32",NA,NA,NA,0.26499,0.20176,-0.26499,0.449172045,-1.145369721,0.615384694,-0.589957715,0.555218999,-0.983177590859822,0,0.00848979631721417,0,-0.0919804184628034,0
47,NA,NA,204,"MMV & SZ",40,1,"Behavioural",NA,204,2016,"Published","Journal Article","Journal Of Behavior Therapy And Experimental Psychiatry","Reducing involuntary memory by interfering consolidation of stressful auditory information: a pilot study","Tabrizi, Fara; Jansson, Billy","billy.jansson@miun.se ","10.1016/j.jbtep.2015.09.003","Web of Science","Sweden","Europe",4,41,26,0.634146341,"24","Between-subject",1,1,1,1,1,1,0,0,0,1,1,8,"Table 1, page 242","Executive task (count backwards for 3 numbers loudly)","Number counting","Decrease","No-Task","No-task","No-Task","Number counting","Behavioural","Verbal","Indirect","Task",11,10,21,"Immediate post","Aversive audio clips","Aversive audio clips","6","10 minutes","IES-R Intrusion subscale score","Intrusion symptoms","IES-R (Intrusion subscale)","Self-report questionnaire","8th day post trauma film",NA,"Retrospective",NA,"Null","Both conditions did not significantly in terms of IES-R intrusion subscale.",NA,NA,"Yes","Null",6.45,NA,5.8,8.1,NA,3.9,"-1.65",NA,NA,"0.282","Not provided","Not provided",NA,"Contact author for their distress level. They didn’t report distress level but did record this data",NA,NA,"Audio","No","Tabrizi & Jansson, 2016","Tabrizi & Jansson, 2016","Tabrizi & Jansson, 2016","Number counting (executive task)","Executive task",NA,NA,NA,-1,"F(3, 37) = 1.32",NA,NA,NA,-0.31734,0.19331,0.31734,0.439666753,-0.544404689,1.179088983,0.721778814,0.470430477,0.206136351529446,0,0.00124769937300364,0,0.0350314040715917,0
57,NA,NA,263,"MMV",49,1,"Behavioural",NA,263,2017,"Published","Journal Article","Annual Review Of Cybertherapy And Telemedicine","Preventing post-traumatic intrusions using virtual reality","Page, Sarah; Coxon, Matthew","sarahjpage17@gmail.com","Not Reported","Web of Science","England","Europe",3,30,18,0.6,"29.07","Between-subject",1,1,1,1,1,1,1,0,0,1,1,9,"page 6","Tetris VR","Trauma reminder + tetris","Decrease","Reminder + No-task","Experimental task","Trauma reminder","Trauma reminder + tetris vs. Trauma reminder","Behavioural","Imagery","Direct + indirect","Task",10,10,20,"Immediate post","Trauma film","Trauma film","Not Reported","Not Reported","IES-R Intrusion subscale score","Intrusion symptoms","IES-R (Intrusion subscale)","Self-report questionnaire","8th day post trauma film",NA,"Retrospective",NA,"Null","Both conditions did not significantly in terms of IES-R INTRUSION SUBSCALE",NA,NA,"No",NA,NA,NA,NA,NA,NA,NA,"#VALUE!",NA,NA,"> .05","Not provided","Not provided",NA,"p value come from Post-hoc tests (unspecified what kind of tests), >0.05 was used to report for multiple results",NA,NA,"Film","No","Page & Coxon, 2017","Page & Coxon, 2017","Page & Coxon, 2017","Trauma reminder + tetris vs. Trauma reminder",NA,NA,NA,NA,NA,NA,NA,NA,NA,NA,NA,NA,NA,NA,NA,NA,NA,NA,NA,NA,NA,NA,NA
57,NA,NA,264,"MMV",49,1,"Behavioural",NA,264,2017,"Published","Journal Article","Annual Review Of Cybertherapy And Telemedicine","Preventing post-traumatic intrusions using virtual reality","Page, Sarah; Coxon, Matthew","sarahjpage17@gmail.com","Not Reported","Web of Science","England","Europe",3,30,18,0.6,"29.07","Between-subject",1,1,1,1,1,1,1,0,0,1,1,9,"page 6","Tetris","Trauma reminder + tetris","Decrease","Reminder + No-task","Experimental task","Trauma reminder","Trauma reminder + tetris vs. Trauma reminder","Behavioural","Imagery","Direct + indirect","Task",10,10,20,"Immediate post","Trauma film","Trauma film","Not Reported","Not Reported","IES-R Intrusion subscale score","Intrusion symptoms","IES-R (Intrusion subscale)","Self-report questionnaire","8th day post trauma film",NA,"Retrospective",NA,"Null","Both conditions did not significantly in terms of IES-R INTRUSION SUBSCALE",NA,NA,"No",NA,NA,NA,NA,NA,NA,NA,"#VALUE!",NA,NA,"> .05","Not provided","Not provided",NA,"p value come from Post-hoc tests (unspecified what kind of tests), >0.05 was used to report for multiple results",NA,NA,"Film","No","Page & Coxon, 2017","Page & Coxon, 2017","Page & Coxon, 2017","Trauma reminder + tetris vs. Trauma reminder",NA,NA,NA,NA,NA,NA,NA,NA,NA,NA,NA,NA,NA,NA,NA,NA,NA,NA,NA,NA,NA,NA,NA
60,NA,NA,273,"SZ",52,1,"Behavioural",NA,273,2013,"Published","Journal Article","Journal Of Behavior Therapy And Experimental Psychiatry","Unconscious thought reduces intrusion development: a replication and extension","Krans, Julie; Janecko, Dorte; Bos, Maarten W.","j.krans@unsw.edu.au","10.1016/j.jbtep.2012.08.004","Web of Science","Australia","Australia",3,51,47,0.921568627,"19.76","Between-subject",1,1,1,1,1,1,1,NA,1,1,1,10,"page 183, Table 1","Unconscious thought condition (2-back working memory task + memory test expectation)","Unconscious imagery re-experience","Decrease","Mere distraction condition (2-back working memory task)","Experimental task","Control (working memory task)","Unconscious imagery re-experience","Behavioural","Imagery","Indirect","Task",17,17,34,"Immediate post","Trauma film","Trauma film","1","8.42min","IES Intrusion subscale score","Intrusion symptoms","IES (Intrusion subscale)","Self-report questionnaire","Same day post trauma film",NA,"Retrospective",NA,"Positive","UT group showed lower intrusion score than MD group",NA,NA,"Yes","Null",5.87,NA,3.63,7.88,NA,5.73,"-2.01",NA,NA,"<0.05","Not provided","Not provided","Contact author for sample size and age information",NA,NA,NA,"Film","No","Krans et al., 2013a","Krans et al., 2013","Krans et al., 2013a","Unconscious imagery re-experience",NA,NA,NA,NA,-1,NA,NA,NA,NA,-0.40916,0.12011,0.40916,0.346567399,-0.270115116,1.08842909,1.180598602,0.237762219,0.476411190848645,0,0.00403956735068352,0,0.0630882571184956,0
75,NA,NA,318,"MMV & SZ",65,2,"Behavioural",NA,318,2018,"Published","Journal Article","Journal Of Behavior Therapy And Experimental Psychiatry","Can an experimental self-efficacy induction through autobiographical recall modulate analogue posttraumatic intrusions?","Krans, Julie; Brown, Adam D.; Moulds, Michelle L.","julie.krans@kuleuven.be ","10.1016/j.jbtep.2017.07.001","Web of Science","Belgium/Australia","Australia/europe",3,74,54,0.72972973,"20.66","Between-subject",1,1,1,1,1,1,0,0,1,1,1,9,"Table 2, page 8","High self efficacy","High self efficacy","Decrease","No self efficacy (recall important memory)","Experimental task","Control (recall important memory)","Self efficacy","Behavioural","Other","Indirect","Task",25,24,49,"Immediate post","Trauma film","Trauma film","1","10 minutes","IES Intrusion subscale score","Intrusion symptoms","IES (Intrusion subscale)","Self-report questionnaire","8th day post trauma film",NA,"Retrospective",NA,"Null","Both conditions did not significantly in terms of IES INTRUSION SUBSCALE",NA,NA,"Yes","Null",9.16,NA,6.2,8.21,NA,5.36,"0.95",NA,NA,NA,"Not provided","Not provided","Is the control task a no-task control or experimental task",NA,NA,NA,"Film","No","Krans et al., 2018, Exp. 2","Krans et al., 2018","Krans et al., 2018, Exp. 2","Self efficacy",NA,NA,NA,NA,1,NA,NA,NA,NA,0.16105,0.08193,-0.16105,0.286236483,-0.72207146,0.399975554,-0.562639505,0.573680386,-1.09225446395727,0,0.0262571958751776,0,-0.162540959825326,0
80,NA,NA,333,"SZ",69,1,"Behavioural",NA,333,2012,"Published","Journal Article","Cognition And Emotion","Fewer intrusions after an attentional bias modification training for perceptual reminders of analogue trauma","Verwoerd, Johan; Wessel, Ineke; de Jong, Peter J.","j.r.l.verwoerd@rug.nl","10.1080/02699931.2011.563521","Web of Science","Netherlands","Europe",2,45,38,0.844444444,"20.1","Between-subject",1,1,1,1,1,1,0,0,0,1,1,8,"page 158","Exogenous cuing task (ECT) training","Attentional bias modification","Decrease","Filler task with no attentional modification","Experimental task","Control (filler task with no attentional modification)","Attentional bias modification","Behavioural","Other","Direct","Task",22,23,45,"Immediate post","Trauma film","Trauma film","5","5min","IES-R Intrusion subscale score","Intrusion symptoms","Impact of Movie Scale (IMS), adapted from IES","Self-report questionnaire","4th day post trauma film",NA,"Retrospective",NA,"Not provided","Not provided",NA,NA,"No",NA,NA,NA,NA,NA,NA,NA,"#VALUE!",NA,NA,NA,"Not provided","Not provided","Contact author for intrusion subscale score",NA,NA,NA,"Film","No","Verwoerd et al., 2012","Verwoerd et al., 2012","Verwoerd et al., 2012","Attentional bias modification",NA,NA,NA,NA,NA,NA,NA,NA,NA,NA,NA,NA,NA,NA,NA,NA,NA,NA,NA,NA,NA,NA,NA
97,NA,NA,389,"MMV",83,1,"Behavioural",NA,389,2019,"Published","Journal Article","Behaviour Research And Therapy","Spatio-temporal associations with memory cues are linked to analogue traumatic intrusions","Meyer, Thomas; Ikani, Nessa; Morina, Nexhmedin","t.meyer@uni-muenster.de","10.1016/j.brat.2019.103481","Web of Science","Germany","Europe",2,96,73,0.760416667,"22.4","Within-subject",1,1,1,1,1,1,0,0,1,1,1,9,"Table 3, page 7","Past verbal training","Past verbal training","Decrease","Now verbal training","Experimental task","Now verbal training","Past vs. Now verbal training","Behavioural","Verbal","Direct","Task",96,96,96,"Immediate post","Trauma film","Trauma film","2","20 minutes","IES-R Intrusion subscale score","Intrusion symptoms","IES-R (Intrusion subscale)","Self-report questionnaire","8th day post trauma film",NA,"Retrospective",NA,"Null","Both conditions did not significantly in terms of intrusion subscale ies-r",NA,NA,"No",NA,13.8,NA,12.6,14.9,NA,5.9,"-1.1",NA,NA,NA,"Not provided","Not provided","reported intrusion frequency separately for total intrusions, image intrusion, thought intrusion~ which one to code. Mean and sd currently summed for two film clips as they were reported separately for each of the two conditions.",NA,NA,NA,"Film","No","Meyer et al., 2019","Meyer et al., 2019","Meyer et al., 2019","Past vs. Now verbal training",NA,NA,NA,NA,-1,NA,NA,NA,NA,-0.11137,0.02087,0.11137,0.144449415,-0.171750833,0.394490874,0.770996685,0.440708896,-0.425003414431638,0,0.00774687669219653,0,-0.0864937394341716,0
107,NA,NA,438,"MMV",93,1,"Behavioural",NA,438,2019,"Published","Journal Article","Behaviour Research And Therapy","The effects of dual-tasks on intrusive memories following analogue trauma","van Schie, Kevin; van Veen, Suzanne C.; Hagenaars, Muriel A.","k.vanschie@essb.eur.nl","10.1016/j.brat.2019.103448","Web of Science","Netherlands","Europe",3,76,54,0.710526316,"21.1","Between-subject",1,1,1,1,1,1,1,0,1,1,1,10,"Table 1, page 5","Recall + Eye Movement","Imagery re-experience + eye movement","Decrease","No-Task","No-task","No-Task","Imagery re-experience + eye movement","Behavioural","Imagery + other","Direct + indirect","Task",25,25,50,"Immediate post","Trauma film","Trauma film","1","9.24 minutes","IES Intrusion subscale score","Intrusion symptoms","IES (Intrusion subscale)","Self-report questionnaire","8th day post trauma film",NA,"Retrospective",NA,"Null","Both conditions did not significantly in terms of intrusion subscale ies",NA,NA,"Yes","Null",7.32,NA,5.39,8.52,NA,6.46,"-1.2",NA,NA,NA,"Not provided","Not provided","Manipulation is same between experiment 1 and 2 but they changed the duration and how long subjects count backwards from 450 to 1000 in exp 1 to exp 2/3~ how to report these changes in coding",NA,NA,NA,"Film","No","van Schie et al., 2019, Exp. 1","van Schie et al., 2019","van Schie et al., 2019, Exp. 1","Imagery re-experience + eye movement",NA,NA,NA,NA,-1,NA,NA,NA,NA,-0.19854,0.08039,0.19854,0.283538677,-0.357195805,0.754275808,0.700221937,0.483788714,-0.0596942069706049,0,0.000792546892948289,0,-0.0278939260304205,0
107,NA,NA,440,"MMV",93,1,"Behavioural",NA,440,2019,"Published","Journal Article","Behaviour Research And Therapy","The effects of dual-tasks on intrusive memories following analogue trauma","van Schie, Kevin; van Veen, Suzanne C.; Hagenaars, Muriel A.","k.vanschie@essb.eur.nl","10.1016/j.brat.2019.103448","Web of Science","Netherlands","Europe",3,76,54,0.710526316,"21.1","Between-subject",1,1,1,1,1,1,1,0,1,1,1,10,"Table 1, page 5","Recall + Counting","Imagery re-experience + number counting","Decrease","No-Task","No-task","No-Task","Imagery re-experience + number counting","Behavioural","Imagery + verbal","Direct + indirect","Task",26,25,51,"Immediate post","Trauma film","Trauma film","1","9.24 minutes","IES Intrusion subscale score","Intrusion symptoms","IES (Intrusion subscale)","Self-report questionnaire","8th day post trauma film",NA,"Retrospective",NA,"Null","Both conditions did not significantly in terms of intrusion subscale ies",NA,NA,"Yes","Null",5.92,NA,4.2,8.52,NA,6.46,"-2.6",NA,NA,NA,"Not provided","Not provided","Manipulation is same between experiment 1 and 2 but they changed the duration and how long subjects count backwards from 450 to 1000 in exp 1 to exp 2/3~ how to report these changes in coding",NA,NA,NA,"Film","No","van Schie et al., 2019, Exp. 1","van Schie et al., 2019","van Schie et al., 2019, Exp. 1","Imagery re-experience + number counting",NA,NA,NA,NA,-1,NA,NA,NA,NA,-0.47181,0.08064,0.47181,0.283978733,-0.084790123,1.028406508,1.661420869,0.096628949,0.727032702093939,0,0.00784397167320335,0,0.0882217981015544,0
108,NA,NA,443,"MMV",93,2,"Behavioural",NA,443,2019,"Published","Journal Article","Behaviour Research And Therapy","The effects of dual-tasks on intrusive memories following analogue trauma","van Schie, Kevin; van Veen, Suzanne C.; Hagenaars, Muriel A.","k.vanschie@essb.eur.nl","10.1016/j.brat.2019.103448","Web of Science","Netherlands","Europe",3,74,50,0.675675676,"20.85","Between-subject",1,1,1,1,1,1,1,0,1,1,1,10,"Table 2, page 6","Recall + Eye Movement","Imagery re-experience + eye movement","Decrease","No-Task","No-task","No-Task","Imagery re-experience + eye movement","Behavioural","Imagery + other","Direct + indirect","Task",25,25,50,"Immediate post","Trauma film","Trauma film","1","9.24 minutes","IES Intrusion subscale score","Intrusion symptoms","IES (Intrusion subscale)","Self-report questionnaire","8th day post trauma film",NA,"Retrospective",NA,"Null","Both conditions did not significantly in terms of intrusion subscale ies",NA,NA,"Yes","Null",7.28,NA,5.05,9.44,NA,5.11,"-2.16",NA,NA,NA,"Not provided","Not provided","Manipulation is same between experiment 1 and 2 but they changed the duration and how long subjects count backwards from 450 to 1000 in exp 1 to exp 2/3~ how to report these changes in coding",NA,NA,NA,"Film","No","van Schie et al., 2019, Exp. 2","van Schie et al., 2019","van Schie et al., 2019, Exp. 2","Imagery re-experience + eye movement",NA,NA,NA,NA,-1,NA,NA,NA,NA,-0.41851,0.08175,0.41851,0.285922133,-0.141902166,0.978912595,1.463703456,0.143274991,0.564000024700705,0,0.000299305843464059,0,0.0173567354931573,0
108,NA,NA,446,"MMV",93,2,"Behavioural",NA,446,2019,"Published","Journal Article","Behaviour Research And Therapy","The effects of dual-tasks on intrusive memories following analogue trauma","van Schie, Kevin; van Veen, Suzanne C.; Hagenaars, Muriel A.","k.vanschie@essb.eur.nl","10.1016/j.brat.2019.103448","Web of Science","Netherlands","Europe",3,74,50,0.675675676,"20.85","Between-subject",1,1,1,1,1,1,1,0,1,1,1,10,"Table 2, page 6","Recall + Counting","Imagery re-experience + number counting","Decrease","No-Task","No-task","No-Task","Imagery re-experience + number counting","Behavioural","Imagery + verbal","Direct + indirect","Task",24,25,49,"Immediate post","Trauma film","Trauma film","1","9.24 minutes","IES Intrusion subscale score","Intrusion symptoms","IES (Intrusion subscale)","Self-report questionnaire","8th day post trauma film",NA,"Retrospective",NA,"Null","Both conditions did not significantly in terms of intrusion subscale ies",NA,NA,"Yes","Null",5.91,NA,3.94,9.44,NA,5.11,"-3.53",NA,NA,NA,"Not provided","Not provided","Manipulation is same between experiment 1 and 2 but they changed the duration and how long subjects count backwards from 450 to 1000 in exp 1 to exp 2/3~ how to report these changes in coding",NA,NA,NA,"Film","No","van Schie et al., 2019, Exp. 2","van Schie et al., 2019","van Schie et al., 2019, Exp. 2","Imagery re-experience + number counting",NA,NA,NA,NA,-1,NA,NA,NA,NA,-0.7592,0.08755,0.7592,0.295885292,0.179262463,1.339132807,2.565851213,0.010292297,1.5274925234444,0,0.0218103340886745,0,0.151244355382387,0
